{
  "schema_version": 1,
  "updated_at": "2026-08-03T18:29:07Z",
  "master_session_id": "S-MASTER-001",
  "policy": {
    "single_master_authority": true,
    "second_master_policy": "recovery_replacement_only",
    "claim_reservation_required_before_creation": true,
    "target_active_domain_orchestrators": 4,
    "max_monitored_sol_orchestrators": 8
  },
  "capacity": {
    "active_domain_orchestrators": 6,
    "cleared_for_creation": 0,
    "target_active_domain_orchestrators": 4,
    "monitoring_limit": 8,
    "unallocated_target_slots": 0,
    "unallocated_monitoring_slots": 2
  },
  "lanes": [
    {
      "lane_id": "LANE-R1-GAMEPLAY-FOUNDATION",
      "title": "Round 1 tip-off continuation",
      "domain": "gameplay_foundation",
      "round_ids": [
        "R1"
      ],
      "task_ids": [
        "R1-TIP-FIDELITY"
      ],
      "readiness": "active",
      "dependency_status": "sequentially_active",
      "reservation_owner_session_id": "S-MASTER-001",
      "orchestrator_session_id": "S-SOL-R1-GAMEPLAY-001",
      "base_sha": "6d8f9c7a99a7ce188f1a523247d3a9b9093860fb",
      "branch": "codex/r1-gameplay-foundation-sol",
      "worktree": "C:/Users/joshs/Projects/tecmo-basketball-port-r1-gameplay-foundation-sol",
      "ownership_claim_ids": [
        "OWN-R1-TIP"
      ],
      "blockers": [],
      "next_gate": "TIP continues independently from accepted CPU+LIVE base 222d75cf under the existing domain Sol and projectless evidence worker. It no longer gates the R1A CPU+LIVE delivery subround.",
      "updated_at": "2026-08-03T18:04:17Z"
    },
    {
      "lane_id": "LANE-R3-SEASON-DATA-FOUNDATION",
      "title": "Round 3A accepted season and data foundation",
      "domain": "season_data",
      "round_ids": [
        "R3A"
      ],
      "task_ids": [
        "R3-SEASON-DATA-FOUNDATION"
      ],
      "readiness": "complete",
      "dependency_status": "complete",
      "reservation_owner_session_id": "S-MASTER-001",
      "orchestrator_session_id": "S-SOL-R3-SEASON-DATA-001",
      "base_sha": "6d8f9c7a99a7ce188f1a523247d3a9b9093860fb",
      "branch": "codex/r3-season-data-foundation-sol",
      "worktree": "C:/Users/joshs/Projects/tecmo-basketball-port-r3-season-data-foundation-sol",
      "ownership_claim_ids": [
        "OWN-R3-SEASON-DATA-FOUNDATION"
      ],
      "blockers": [],
      "next_gate": "Accepted season/data foundation is frozen at f536a193. Its separate R3A Integration QA lane is cleared for creation and no longer waits for downstream statistics, save, management, or All-Star tasks.",
      "updated_at": "2026-08-03T18:04:17Z"
    },
    {
      "lane_id": "LANE-R1A-INTEGRATION-QA",
      "title": "Round 1A CPU and LIVE Integration QA",
      "domain": "integration",
      "round_ids": [
        "R1A"
      ],
      "task_ids": [
        "R1A-INTEGRATION-QA"
      ],
      "readiness": "active",
      "dependency_status": "ready",
      "reservation_owner_session_id": "S-MASTER-001",
      "orchestrator_session_id": "S-SOL-R1A-INTEGRATION-QA-001",
      "base_sha": "222d75cfafa9153db1eb44492bf557f11b1a9091",
      "branch": "codex/r1a-cpu-live-integration-qa-sol",
      "worktree": "C:/Users/joshs/Projects/tecmo-basketball-port-r1a-cpu-live-integration-qa-sol",
      "ownership_claim_ids": [
        "OWN-R1A-INTEGRATION-QA"
      ],
      "blockers": [],
      "next_gate": "Pinned Integration QA Sol 019fc8d2-0d1e-78d2-a506-58a5da24db16 and its sole pinned projectless Luna 019fc8d6-7a77-79d0-a352-767a228ef478 are auditing exact 222d75cf. Sol personally owns combined build/suite/smoke/media review and may write only signed QA docs; master pushes only after terminal acceptance.",
      "updated_at": "2026-08-03T18:15:27Z"
    },
    {
      "lane_id": "LANE-R3A-INTEGRATION-QA",
      "title": "Round 3A Season Data Integration QA",
      "domain": "integration",
      "round_ids": [
        "R3A"
      ],
      "task_ids": [
        "R3A-INTEGRATION-QA"
      ],
      "readiness": "active",
      "dependency_status": "ready",
      "reservation_owner_session_id": "S-MASTER-001",
      "orchestrator_session_id": "S-SOL-R3A-INTEGRATION-QA-001",
      "base_sha": "f536a19398803742e1a3dc5bb33d8a6ee2968a24",
      "branch": "codex/r3a-season-data-integration-qa-sol",
      "worktree": "C:/Users/joshs/Projects/tecmo-basketball-port-r3a-season-data-integration-qa-sol",
      "ownership_claim_ids": [
        "OWN-R3A-INTEGRATION-QA"
      ],
      "blockers": [],
      "next_gate": "Pinned Integration QA Sol 019fc8d2-986a-7643-978f-099070876dfb and its sole pinned projectless Luna 019fc8d7-50f8-77f1-b379-8bcc33280ae5 are auditing exact f536a193. Sol personally owns combined build/team-data/season/frame/provenance review and may write only signed QA docs; master pushes only after terminal acceptance.",
      "updated_at": "2026-08-03T18:16:22Z"
    },
    {
      "lane_id": "LANE-R4-FRONTEND-INTRO-TITLE",
      "title": "Round 4 frontend intro and title",
      "domain": "frontend",
      "round_ids": [
        "R4"
      ],
      "task_ids": [
        "R4-FRONTEND-INTRO-TITLE"
      ],
      "readiness": "active",
      "dependency_status": "ready",
      "reservation_owner_session_id": "S-MASTER-001",
      "orchestrator_session_id": "S-SOL-R4-FRONTEND-001",
      "base_sha": "6d8f9c7a99a7ce188f1a523247d3a9b9093860fb",
      "branch": "codex/r4-frontend-intro-title-sol",
      "worktree": "C:/Users/joshs/Projects/tecmo-basketball-port-r4-frontend-intro-title-sol",
      "ownership_claim_ids": [
        "OWN-R4-FRONTEND-INTRO-TITLE"
      ],
      "blockers": [],
      "next_gate": "Native hardening plus accepted three-commit finale lineage are integrated cleanly at a40dc3f; combined /W4 build, 28/28 suite, 47 masks, 11 color cases, repeats, source/ASM and visual gates pass. Accepted finale worker is completed/unpinned. Reuse held proof worker against a40dc3f for corrected production replay, media inspection, and independent QA before domain acceptance.",
      "updated_at": "2026-08-03T17:52:20Z"
    },
    {
      "lane_id": "LANE-R4-AUDIO-FOUNDATION",
      "title": "Round 4A accepted audio foundation",
      "domain": "audio",
      "round_ids": [
        "R4A"
      ],
      "task_ids": [
        "R4-AUDIO-FOUNDATION"
      ],
      "readiness": "complete",
      "dependency_status": "complete",
      "reservation_owner_session_id": "S-MASTER-001",
      "orchestrator_session_id": "S-SOL-R4-AUDIO-001",
      "base_sha": "6d8f9c7a99a7ce188f1a523247d3a9b9093860fb",
      "branch": "codex/r4-audio-foundation-sol",
      "worktree": "C:/Users/joshs/Projects/tecmo-basketball-port-r4-audio-foundation-sol",
      "ownership_claim_ids": [
        "OWN-R4-AUDIO-FOUNDATION"
      ],
      "blockers": [],
      "next_gate": "Isolated audio foundation is terminally accepted, writer/QA/domain Sol are completed/unpinned, and exact e120c30 is physically staged. Its separate R4A Integration QA lane is cleared; broader cross-domain ACC-AUDIO remains deferred in parent R4.",
      "updated_at": "2026-08-03T18:21:12Z"
    },
    {
      "lane_id": "LANE-R4A-INTEGRATION-QA",
      "title": "Round 4A Audio Foundation Integration QA",
      "domain": "integration",
      "round_ids": [
        "R4A"
      ],
      "task_ids": [
        "R4A-INTEGRATION-QA"
      ],
      "readiness": "active",
      "dependency_status": "ready",
      "reservation_owner_session_id": "S-MASTER-001",
      "orchestrator_session_id": "S-SOL-R4A-INTEGRATION-QA-001",
      "base_sha": "e120c30ee882fe07b37496e2742ac83f1d16ff3a",
      "branch": "codex/r4a-audio-integration-qa-sol",
      "worktree": "C:/Users/joshs/Projects/tecmo-basketball-port-r4a-audio-integration-qa-sol",
      "ownership_claim_ids": [
        "OWN-R4A-INTEGRATION-QA"
      ],
      "blockers": [],
      "next_gate": "Integration Sol personally completes clean build and Music/Frontend/Gameplay suites, proof/event/WAV/waveform/provenance audit, objective inspection, honest external listening attribution, independent Luna P0/P1/P2 closure, and signed docs-only commit.",
      "updated_at": "2026-08-03T18:29:07Z"
    },
    {
      "lane_id": "LANE-R2-SHOTS-OUTCOMES",
      "title": "Round 2 shots and outcomes",
      "domain": "gameplay_behavior",
      "round_ids": [
        "R2"
      ],
      "task_ids": [
        "R2-SHOTS-OUTCOMES"
      ],
      "readiness": "active",
      "dependency_status": "ready",
      "reservation_owner_session_id": "S-MASTER-001",
      "orchestrator_session_id": "S-SOL-R2-SHOTS-001",
      "base_sha": "222d75cfafa9153db1eb44492bf557f11b1a9091",
      "branch": "codex/r2-shots-outcomes-sol",
      "worktree": "C:/Users/joshs/Projects/tecmo-basketball-port-r2-shots-outcomes-sol",
      "ownership_claim_ids": [
        "OWN-R2-SHOTS-OUTCOMES"
      ],
      "blockers": [],
      "next_gate": "Evidence auditor 019fc8a8-186e-7be2-aab3-0aae3da3a2fa is accepted/completed/unpinned. One persistent writable Luna 019fc8cb-3d2c-7171-bbe8-534028387b6e is active/pinned on the isolated codex/r2-shots-outcomes-luna worktree and must preserve accepted LIVE far-shot deferral.",
      "updated_at": "2026-08-03T18:03:10Z"
    }
  ]
}
